{
 "schemaVersion": 2,
 "contractMigration": {
  "schemaId": "test-counts.v2",
  "previousSchemaId": "test-counts.v1",
  "fromSchemaVersion": 1,
  "toSchemaVersion": 2,
  "breaking": true,
  "policy": {
   "document": "docs/SCHEMA_VERSIONING_POLICY.md",
   "policyVersion": 1,
   "decisionRule": "language-subset",
   "note": "判定は新旧 2 つの schema だけで行う。artifact の中身は見ない"
  },
  "consumerAction": "**schemaVersion で分岐すること。**1 を期待する実装は 2 を受け取ったら停止する。allPassed は failed と exitCode の両方から決まる。**allPassed が false の artifact は配布してはいけない**（npm run release:stage が拒否する）。**artifact の配布名は変わらない**。",
  "renamedAssets": [
   {
    "from": "test-counts.v1.schema.json",
    "to": "test-counts.v2.schema.json",
    "reason": "schema ファイル名。artifact 側の名前は変わらない"
   }
  ],
  "history": [
   {
    "shippedIn": "v0.4.1",
    "previousRelease": "v0.4.0",
    "previousSchemaPath": "schemas/test-counts.v1.schema.json",
    "currentSchemaPath": "schemas/test-counts.v1.schema.json",
    "schemaVersionAtTheTime": 1,
    "schemaVersionShouldHaveBeen": 2,
    "versionWasHeld": true,
    "policyVerdict": "BUMP",
    "recordedRetroactivelyIn": "v0.5.0",
    "changes": [
     {
      "kind": "field-added",
      "effect": "WIDEN",
      "schemaPointer": "/properties/exitCode",
      "instancePath": "$.exitCode",
      "added": [
       "exitCode"
      ],
      "reason": "件数を「どの実行から取ったか」まで含めて記録するようにした（v0.4.0 で allPassed:false のまま公開した件の対策）"
     },
     {
      "kind": "field-added",
      "effect": "WIDEN",
      "schemaPointer": "/properties/failed",
      "instancePath": "$.failed",
      "added": [
       "failed"
      ],
      "reason": "同上"
     },
     {
      "kind": "field-added",
      "effect": "WIDEN",
      "schemaPointer": "/properties/failedSuites",
      "instancePath": "$.failedSuites",
      "added": [
       "failedSuites"
      ],
      "reason": "同上"
     },
     {
      "kind": "field-added",
      "effect": "WIDEN",
      "schemaPointer": "/properties/generatedFromCommit",
      "instancePath": "$.generatedFromCommit",
      "added": [
       "generatedFromCommit"
      ],
      "reason": "同上"
     },
     {
      "kind": "field-added",
      "effect": "WIDEN",
      "schemaPointer": "/properties/nodeVersion",
      "instancePath": "$.nodeVersion",
      "added": [
       "nodeVersion"
      ],
      "reason": "同上"
     },
     {
      "kind": "field-added",
      "effect": "WIDEN",
      "schemaPointer": "/properties/runner",
      "instancePath": "$.runner",
      "added": [
       "runner"
      ],
      "reason": "同上"
     },
     {
      "kind": "field-added",
      "effect": "WIDEN",
      "schemaPointer": "/properties/runnerVersion",
      "instancePath": "$.runnerVersion",
      "added": [
       "runnerVersion"
      ],
      "reason": "同上"
     },
     {
      "kind": "field-added",
      "effect": "WIDEN",
      "schemaPointer": "/properties/testCommand",
      "instancePath": "$.testCommand",
      "added": [
       "testCommand"
      ],
      "reason": "同上"
     },
     {
      "kind": "constraint-tightened",
      "effect": "NARROW",
      "schemaPointer": "/required",
      "instancePath": "$",
      "added": [
       "exitCode",
       "failed",
       "generatedFromCommit",
       "nodeVersion",
       "runner",
       "runnerVersion",
       "testCommand"
      ],
      "reason": "必須にした。**旧 artifact は新 schema で落ちる**"
     }
    ]
   },
   {
    "shippedIn": "v0.5.0",
    "previousRelease": "v0.4.1",
    "previousSchemaPath": "schemas/test-counts.v1.schema.json",
    "currentSchemaPath": "schemas/test-counts.v2.schema.json",
    "schemaVersionAtTheTime": 2,
    "versionWasHeld": false,
    "policyVerdict": "BUMP",
    "changes": [
     {
      "kind": "const-changed",
      "effect": "UNDECIDABLE",
      "schemaPointer": "/properties/schemaVersion/const",
      "instancePath": "$.schemaVersion",
      "from": 1,
      "to": 2,
      "reason": "版を上げた。**下流はここで分岐して止まる**"
     },
     {
      "kind": "field-added",
      "effect": "WIDEN",
      "schemaPointer": "/properties/contractMigration",
      "instancePath": "$.contractMigration",
      "added": [
       "contractMigration"
      ],
      "reason": "**この schema には対応表が無かった。**v0.4.1 で契約を変えたのに記録が残っていなかった原因の一つ"
     },
     {
      "kind": "constraint-tightened",
      "effect": "NARROW",
      "schemaPointer": "/required",
      "instancePath": "$",
      "added": [
       "contractMigration"
      ],
      "reason": "対応表を必須にした。**旧 artifact は新 schema で落ちる**"
     }
    ]
   }
  ]
 },
 "generatedAt": "2026-10-18",
 "note": "npm run test:count で生成。README と UNKNOWNS には件数を書かない (読者に意味が無く、手作業が増えるだけだった)。docs/TEST_RESULTS.md の件数だけをこの artifact と突き合わせる。byFile は npm run check:vacuity の下限としても使う。件数が減る変更は理由を書く。",
 "total": 1480,
 "byFile": {
  "ciWorkflow.test.ts": 38,
  "cliOutputBaseline.test.ts": 7,
  "cliResultContract.test.ts": 12,
  "contact.test.ts": 41,
  "contractMigration.test.ts": 38,
  "corruptTar.test.ts": 32,
  "dimensions.test.ts": 16,
  "docs.test.ts": 72,
  "generatorDependencyClosure.test.ts": 14,
  "halfPlugProfile.test.ts": 23,
  "mainInjection.test.ts": 12,
  "measurementGate.test.ts": 41,
  "provenance.test.ts": 8,
  "publishedAssetBaseline.test.ts": 18,
  "realJackComparison.test.ts": 12,
  "reasonCodeCatalog.test.ts": 13,
  "reasonCodeReachability.test.ts": 36,
  "releaseIndex.test.ts": 28,
  "robustnessWindowFixtures.test.ts": 16,
  "schemaContractV2.test.ts": 34,
  "schemaLanguageFuzz.test.ts": 17,
  "schemaVersioningPolicy.test.ts": 114,
  "sensitivityProvenance.test.ts": 29,
  "sensitivityVariant.test.ts": 9,
  "sourceInputScope.test.ts": 26,
  "sourceVerificationResult.test.ts": 25,
  "sourceVerifierCliResult.test.ts": 13,
  "stageAttestation.test.ts": 15,
  "staleWordingAndPaths.test.ts": 11,
  "tarExtractionOracle.test.ts": 311,
  "tarHardening.test.ts": 225,
  "testEvidenceBinding.test.ts": 14,
  "topology.test.ts": 15,
  "topologyRobustness.test.ts": 44,
  "topologySearch.test.ts": 16,
  "trrs.test.ts": 26,
  "uiStrings.test.ts": 25,
  "verifierEntryPoint.test.ts": 6,
  "verifyReleaseSourceInputs.test.ts": 28
 },
 "skipped": 0,
 "failed": 0,
 "failedSuites": 0,
 "exitCode": 0,
 "allPassed": true,
 "testCommand": "npx vitest run --reporter=json",
 "runner": "vitest",
 "runnerVersion": "4.1.10",
 "nodeVersion": "v22.22.3",
 "generatedFromCommit": "e41738af164b8af280adc4aa2f13f2470cfa41cf"
}
